{
  "schema": "a4w.tool/v1",
  "kind": "operation",
  "name": "update_page",
  "title": "페이지 고치기",
  "description": "페이지의 제목이나 본문을 고친다. 보낸 것만 바뀌고 본문은 통째로 바뀐다(부분 수정 없음). 먼저 read_page로 읽고 받은 currentVersionNo를 baseVersionNo로 꼭 보낸다. 그 사이 다른 저장이 있으면 409 VERSION_CONFLICT, 누가 편집 중이면 409 PAGE_BEING_EDITED다 — 다시 읽고 합쳐서 고친다.",
  "inputSchema": {
    "type": "object",
    "properties": {
      "id": {
        "format": "uuid",
        "type": "string",
        "description": "고칠 페이지 id — read_page 결과의 id"
      },
      "baseVersionNo": {
        "description": "기준 버전 — read_page 결과의 currentVersionNo를 그대로",
        "maximum": 2147483647,
        "minimum": 1,
        "type": "integer"
      },
      "body": {
        "description": "새 본문 전체 (마크다운 글). 고치지 않으면 비운다"
      },
      "title": {
        "description": "새 제목. 고치지 않으면 비운다",
        "maxLength": 300,
        "minLength": 1,
        "type": "string"
      }
    },
    "required": [
      "id",
      "baseVersionNo"
    ],
    "additionalProperties": false
  },
  "http": {
    "method": "PATCH",
    "path": "/pages/{id}",
    "contentType": "application/json",
    "bindings": [
      {
        "input": "id",
        "in": "path",
        "name": "id"
      },
      {
        "input": "baseVersionNo",
        "in": "body",
        "pointer": "/baseVersionNo"
      },
      {
        "input": "body",
        "in": "body",
        "pointer": "/body"
      },
      {
        "input": "title",
        "in": "body",
        "pointer": "/title"
      }
    ],
    "fixed": [],
    "omitted": [
      "format",
      "body_format"
    ],
    "success": [
      200
    ]
  },
  "response": {
    "fields": [
      "id",
      "title",
      "currentVersionNo"
    ],
    "maxChars": 8000
  },
  "risk": "write",
  "scopes": [
    "write"
  ],
  "group": "authoring",
  "index": {
    "summary": "이미 있는 페이지의 제목이나 본문을 고친다. 새로 만들지 않는다",
    "examples": [
      "이 문서 내용 수정해줘",
      "페이지 제목 바꿔줘",
      "본문에 결정 사항 덧붙여줘",
      "오래된 내용 고쳐줘",
      "문서 마지막에 한 줄 추가",
      "페이지 본문 고치기",
      "Update this page",
      "Change the page title"
    ]
  },
  "source": {
    "operationId": "pages.update",
    "method": "PATCH",
    "path": "/pages/{id}",
    "specVersion": "4283c9bf8068f47335af33c9f1bf722e501b1f36d4ed5aad7aed4ab9d8ee60ad",
    "fragmentSha256": "11aab07f919488ab7aa5987d3d3237a72e4a2f5f693cfcb25f71601c60ab3dde",
    "structureSha256": "7bf11328e199076d2f5c66329b5b8ebab832469cc8a2163074b39af84ac10d3c"
  },
  "origin": "seed",
  "revision": "r-0f1296a0b57a"
}
