{
  "schema": "a4w.tool/v1",
  "kind": "operation",
  "name": "list_space_members",
  "title": "스페이스 Crew 보기",
  "description": "스페이스의 Crew(멤버)를 아이디(username)·표시 이름·역할(owner·editor·viewer)과 함께 본다.",
  "inputSchema": {
    "type": "object",
    "properties": {
      "id": {
        "format": "uuid",
        "type": "string",
        "description": "스페이스 id — list_spaces 결과의 items[].id 또는 create_space 결과의 id"
      }
    },
    "required": [
      "id"
    ],
    "additionalProperties": false
  },
  "http": {
    "method": "GET",
    "path": "/spaces/{id}/members",
    "bindings": [
      {
        "input": "id",
        "in": "path",
        "name": "id"
      }
    ],
    "fixed": [],
    "success": [
      200
    ]
  },
  "response": {
    "fields": [
      "[].username",
      "[].displayName",
      "[].role"
    ],
    "maxChars": 8000
  },
  "risk": "read",
  "scopes": [
    "read"
  ],
  "group": "read",
  "index": {
    "summary": "스페이스에 누가 Crew(멤버)로 들어 있는지와 각자의 역할을 본다",
    "examples": [
      "이 스페이스에 누가 있어?",
      "공간 멤버 목록 보여줘",
      "민수가 이 스페이스에 들어 있어?",
      "Crew 역할 확인해줘",
      "스페이스 편집자가 누구야?",
      "스페이스 멤버 목록 보기",
      "Who is in this space?",
      "List space members"
    ]
  },
  "source": {
    "operationId": "spaces.members",
    "method": "GET",
    "path": "/spaces/{id}/members",
    "specVersion": "4283c9bf8068f47335af33c9f1bf722e501b1f36d4ed5aad7aed4ab9d8ee60ad",
    "fragmentSha256": "d3474cf5f2c8b306a7f2cb3948cb7051027327fbf61b93f7a85cdd772cbaaf9c",
    "structureSha256": "61f9d6bb29129f199388e66b30a1ec70cd2a6e58f5c6619831cfe96b935e4b1f"
  },
  "origin": "seed",
  "revision": "r-6c2bcabf0cba"
}
