{
  "schema": "a4w.tool/v1",
  "kind": "operation",
  "name": "list_spaces",
  "title": "스페이스 목록 보기",
  "description": "내가 볼 수 있는 스페이스 목록을 이름·설명·만든 사람·쓰기 가능 여부와 함께 본다. 이름 일부, 만든 사람, 든 사람으로 좁힐 수 있다. 없는 사람이면 404 USER_NOT_FOUND다. 많으면 잘리고 truncated가 true다.",
  "inputSchema": {
    "type": "object",
    "properties": {
      "q": {
        "maxLength": 100,
        "type": "string",
        "description": "찾을 스페이스 이름의 일부 — 요청 글에 스페이스 이름이 있을 때만 넣는다. 대소문자 무시"
      },
      "createdBy": {
        "maxLength": 200,
        "minLength": 1,
        "type": "string",
        "description": "만든 사람의 아이디(username) — 요청에 만든 사람('네가·내가·○○가 만든')이 있을 때만 넣는다. 나는 내 아이디, 방 참여자는 참여자 목록의 username"
      },
      "member": {
        "maxLength": 200,
        "minLength": 1,
        "type": "string",
        "description": "그 사람이 든(Crew이거나 만든) 스페이스만 볼 때 그 사람의 아이디(username) — 요청에 있을 때만 넣는다"
      }
    },
    "required": [],
    "additionalProperties": false
  },
  "http": {
    "method": "GET",
    "path": "/spaces",
    "bindings": [
      {
        "input": "q",
        "in": "query",
        "name": "q"
      },
      {
        "input": "createdBy",
        "in": "query",
        "name": "createdBy"
      },
      {
        "input": "member",
        "in": "query",
        "name": "member"
      }
    ],
    "fixed": [],
    "omitted": [
      "limit"
    ],
    "success": [
      200
    ]
  },
  "response": {
    "fields": [
      "items[].id",
      "items[].name",
      "items[].description",
      "items[].canWrite",
      "items[].createdByUsername",
      "items[].createdByName",
      "truncated"
    ],
    "maxChars": 8000
  },
  "risk": "read",
  "scopes": [
    "read"
  ],
  "group": "read",
  "index": {
    "summary": "만들거나 고치지 않고 내가 볼 수 있는 스페이스 목록과 이름·설명·만든 사람을 본다. 이름이나 만든 사람으로 찾거나 있는지 확인할 때 쓴다",
    "examples": [
      "스페이스 뭐뭐 있는지 알려줘",
      "스터디 스페이스가 있는지 확인해줘",
      "이름에 개발이 들어간 공간 찾아줘",
      "내가 글 쓸 수 있는 스페이스만 골라줘",
      "네가 만든 스페이스 이름이 뭐야?",
      "스페이스 목록을 보고 이름으로 찾기",
      "Show me all spaces",
      "Is there a space named Design Team?"
    ]
  },
  "source": {
    "operationId": "spaces.list",
    "method": "GET",
    "path": "/spaces",
    "specVersion": "4283c9bf8068f47335af33c9f1bf722e501b1f36d4ed5aad7aed4ab9d8ee60ad",
    "fragmentSha256": "b9615210de35a96afa76c3e5576b1f8a38fe943e66b34df0865d499e6f642bb7",
    "structureSha256": "0a4e703f70e50f0242760d81988796a2e3c4be465cdc3e4c6887e07ec941c345"
  },
  "origin": "seed",
  "revision": "r-e9dc693734d9"
}
