{
  "description": "기본 스페이스에서 제목으로 페이지를 하나 찾아 댓글을 단다. 본문은 마크다운이다. 여러 개가 맞으면 AMBIGUOUS와 후보 목록이 오니, 더 정확한 제목으로 다시 하거나 후보의 pageId로 add_comment를 쓴다.",
  "group": "communication",
  "index": {
    "examples": [
      "회의록 페이지에 확인했다고 댓글 달아줘",
      "배포 가이드에 질문 남겨줘",
      "온보딩 문서에 의견 써줘",
      "제목이 주간보고인 글에 댓글",
      "보안 정책 페이지에 피드백 달아",
      "제목으로 페이지 찾아 댓글 달기",
      "Comment on the page titled Release Notes",
      "Leave a comment on the onboarding page"
    ],
    "summary": "페이지 id 없이 제목으로 페이지를 찾아 댓글을 단다"
  },
  "inputSchema": {
    "additionalProperties": false,
    "properties": {
      "body": {
        "description": "댓글 본문 (마크다운 글)",
        "type": "string"
      },
      "title": {
        "description": "댓글을 달 페이지 제목 (요청 글에 나온 그대로)",
        "type": "string"
      }
    },
    "required": [
      "title",
      "body"
    ],
    "type": "object"
  },
  "kind": "composite",
  "name": "comment_on_page_by_title",
  "origin": "seed",
  "output": {
    "$step": "comment"
  },
  "revision": "r-4b72eba00cb8",
  "risk": "write",
  "schema": "a4w.tool/v1",
  "scopes": [
    "read",
    "write"
  ],
  "steps": [
    {
      "args": {
        "q": {
          "$input": "title"
        }
      },
      "expect": {
        "count": "one",
        "pointer": "/items"
      },
      "id": "find",
      "tool": "search_pages"
    },
    {
      "args": {
        "body": {
          "$input": "body"
        },
        "pageId": {
          "$step": "find",
          "pointer": "/items/0/pageId"
        }
      },
      "id": "comment",
      "tool": "add_comment"
    }
  ],
  "title": "제목으로 페이지 찾아 댓글 달기"
}
