{
  "schema": "a4w.tool/v1",
  "kind": "operation",
  "name": "list_attachments",
  "title": "페이지의 첨부 보기",
  "description": "페이지에 올린 첨부 파일 목록을 이름·크기와 함께 본다. href를 본문에 [이름](주소)로 넣으면 사람이 눌러 받는다.",
  "inputSchema": {
    "type": "object",
    "properties": {
      "pageId": {
        "format": "uuid",
        "type": "string",
        "description": "페이지 id — search_pages 결과의 items[].pageId"
      }
    },
    "required": [
      "pageId"
    ],
    "additionalProperties": false
  },
  "http": {
    "method": "GET",
    "path": "/pages/{pageId}/attachments",
    "bindings": [
      {
        "input": "pageId",
        "in": "path",
        "name": "pageId"
      }
    ],
    "fixed": [],
    "success": [
      200
    ]
  },
  "response": {
    "fields": [
      "items[].id",
      "items[].filename",
      "items[].size",
      "items[].href"
    ],
    "maxChars": 8000
  },
  "risk": "read",
  "scopes": [
    "read"
  ],
  "group": "read",
  "index": {
    "summary": "페이지 하나에 붙은 첨부 파일 목록(이름·크기)을 본다. 파일 내용을 읽지는 않는다",
    "examples": [
      "이 문서에 첨부 뭐 있어?",
      "페이지에 올라간 파일 목록",
      "회의록 첨부파일 이름 알려줘",
      "그 글에 파일 붙어 있어?",
      "첨부 목록 확인해줘",
      "페이지 첨부 목록 보기",
      "List attachments on this page",
      "What files are attached?"
    ]
  },
  "source": {
    "operationId": "attachments.list",
    "method": "GET",
    "path": "/pages/{pageId}/attachments",
    "specVersion": "4283c9bf8068f47335af33c9f1bf722e501b1f36d4ed5aad7aed4ab9d8ee60ad",
    "fragmentSha256": "3e0d4b9bf717b4f173eab390761230911229f6a94fe37db35f7b5e1ae426704c",
    "structureSha256": "dda1f0daba1fa783894cb211b0ffeb51e7c277e90dcb1c02a9e5c1a156d695fb"
  },
  "origin": "seed",
  "revision": "r-4ed9092eb156"
}
