{
  "schema": "a4w.tool/v1",
  "kind": "operation",
  "name": "delete_attachment",
  "title": "첨부 지우기",
  "description": "첨부 파일 하나를 지운다. 쓸 수 있는 사람이나 올린 사람만 지운다.",
  "inputSchema": {
    "type": "object",
    "properties": {
      "id": {
        "format": "uuid",
        "type": "string",
        "description": "지울 첨부 id — list_attachments 결과의 items[].id"
      }
    },
    "required": [
      "id"
    ],
    "additionalProperties": false
  },
  "http": {
    "method": "DELETE",
    "path": "/attachments/{id}",
    "bindings": [
      {
        "input": "id",
        "in": "path",
        "name": "id"
      }
    ],
    "fixed": [],
    "success": [
      200
    ]
  },
  "response": {
    "maxChars": 8000
  },
  "risk": "danger",
  "scopes": [
    "write"
  ],
  "group": "danger",
  "index": {
    "summary": "페이지의 첨부 파일을 지운다",
    "examples": [
      "그 첨부 파일 지워줘",
      "잘못 올린 파일 삭제해줘",
      "첨부 없애줘"
    ]
  },
  "source": {
    "operationId": "attachments.delete",
    "method": "DELETE",
    "path": "/attachments/{id}",
    "specVersion": "8c83f9c66a3a6a0acc82bbc386954cffb2fc24fb031f21bf123700e518a2b1e6",
    "fragmentSha256": "2c5a316fb52fca9fa00587bd55b6e3e87b6a3dc8a47bb79ee1c7d47ad3dfc7a7",
    "structureSha256": "3e94a43528142e00d5d9fff220d17c32fba4e87ad4c81898ab09f0aebdbf85b2"
  },
  "origin": "seed",
  "revision": "r-d6b197dc8edf"
}
