{
  "schema": "a4w.tool/v1",
  "kind": "operation",
  "name": "list_pages",
  "title": "기본 스페이스의 페이지 목록 보기",
  "description": "agent의 기본 스페이스에 있는 페이지를 본문 없이 제목·부모(parentId)와 함께 본다. 트리는 parentId로 그린다. 많으면 잘리고 truncated가 true다(total은 전체 수). 본문은 read_page로 읽는다.",
  "inputSchema": {
    "type": "object",
    "properties": {
      "createdBy": {
        "maxLength": 200,
        "minLength": 1,
        "type": "string",
        "description": "만든 사람의 아이디(username) — 요청에 만든 사람('네가·내가·○○가 만든')이 있을 때만 넣는다. 나는 내 아이디, 방 참여자는 참여자 목록의 username"
      },
      "updatedBy": {
        "maxLength": 200,
        "minLength": 1,
        "type": "string",
        "description": "마지막으로 고친 사람의 아이디(username) — 요청에 고친 사람이 있을 때만 넣는다"
      }
    },
    "required": [],
    "additionalProperties": false
  },
  "http": {
    "method": "GET",
    "path": "/pages",
    "bindings": [
      {
        "input": "createdBy",
        "in": "query",
        "name": "createdBy"
      },
      {
        "input": "updatedBy",
        "in": "query",
        "name": "updatedBy"
      }
    ],
    "fixed": [
      {
        "in": "query",
        "name": "space",
        "context": "homeSpace"
      }
    ],
    "omitted": [
      "limit"
    ],
    "success": [
      200
    ]
  },
  "response": {
    "fields": [
      "items[].id",
      "items[].title",
      "items[].parentId",
      "items[].createdByUsername",
      "items[].updatedByUsername",
      "total",
      "truncated"
    ],
    "maxChars": 8000
  },
  "risk": "read",
  "scopes": [
    "read"
  ],
  "group": "read",
  "index": {
    "summary": "기본 스페이스의 페이지를 본문 없이 제목과 상하 관계(트리)로 훑어본다. 단어로 찾는 검색이 아니다",
    "examples": [
      "위키에 어떤 문서들이 있는지 훑어봐줘",
      "페이지 트리 구조 보여줘",
      "하위 페이지가 뭐가 있는지 알려줘",
      "전체 문서 제목 목록 줘",
      "내가 만든 페이지들만 보여줘",
      "페이지 목록을 보고 구조 확인",
      "List all pages in the wiki",
      "Show me the page tree"
    ]
  },
  "source": {
    "operationId": "pages.tree",
    "method": "GET",
    "path": "/pages",
    "specVersion": "4283c9bf8068f47335af33c9f1bf722e501b1f36d4ed5aad7aed4ab9d8ee60ad",
    "fragmentSha256": "771fc482d620f8bda035c2f12e66f9d2b4b5abd7f97a9e42519800a4f9ea0f7c",
    "structureSha256": "4cad36aa3aed5b0d02ae5819151a2ba67dfa645a13a933f33f3876f27430a591"
  },
  "origin": "seed",
  "revision": "r-44523b0c3f88"
}
