{
  "schema": "a4w.tool/v1",
  "kind": "operation",
  "name": "get_space",
  "title": "스페이스 정보 보기",
  "description": "스페이스 하나의 이름·설명·상태와 내 역할(myRole), 쓸 수 있는지(canWrite)를 본다.",
  "inputSchema": {
    "type": "object",
    "properties": {
      "id": {
        "format": "uuid",
        "type": "string",
        "description": "스페이스 id — list_spaces 결과의 items[].id"
      }
    },
    "required": [
      "id"
    ],
    "additionalProperties": false
  },
  "http": {
    "method": "GET",
    "path": "/spaces/{id}",
    "bindings": [
      {
        "input": "id",
        "in": "path",
        "name": "id"
      }
    ],
    "fixed": [],
    "success": [
      200
    ]
  },
  "response": {
    "fields": [
      "id",
      "name",
      "description",
      "status",
      "myRole",
      "canWrite",
      "createdByUsername",
      "createdByName",
      "createdAt"
    ],
    "maxChars": 8000
  },
  "risk": "read",
  "scopes": [
    "read"
  ],
  "group": "read",
  "index": {
    "summary": "목록이 아니라 스페이스 한 곳의 상세 정보(설명·상태)와 그곳에서 내 역할·쓰기 가능 여부를 본다",
    "examples": [
      "그 공간은 무슨 용도야?",
      "이 스페이스에서 나는 무슨 역할이야?",
      "그 스페이스가 중지된 상태인지 봐줘",
      "내가 이 공간에 페이지 만들 수 있어?",
      "스페이스 상세 정보 보여줘",
      "스페이스 하나의 정보와 내 권한 보기",
      "What is my role in this space?",
      "Show details of this space"
    ]
  },
  "source": {
    "operationId": "spaces.get",
    "method": "GET",
    "path": "/spaces/{id}",
    "specVersion": "4283c9bf8068f47335af33c9f1bf722e501b1f36d4ed5aad7aed4ab9d8ee60ad",
    "fragmentSha256": "6b31fec4de132e09d31aa17fd87654b7c80036160749ec9a0f0b398aa1097e1a",
    "structureSha256": "e705d5db006d455947781469734b27267c8494ea55793c80c64f7cad1dd2a8b2"
  },
  "origin": "seed",
  "revision": "r-f24acf16b865"
}
